\set VERBOSITY terse
-- predictability
SET synchronous_commit = on;
DROP TABLE IF EXISTS tbl;
CREATE TABLE tbl (id int);
DROP TABLE IF EXISTS results;
CREATE UNLOGGED TABLE results (data json);
SELECT 'init' FROM pg_create_logical_replication_slot('regression_slot', 'wal2json');
 ?column? 
----------
 init
(1 row)

-- One change should have one change_number
INSERT INTO tbl VALUES (1);
INSERT INTO results SELECT data::json FROM pg_logical_slot_get_changes('regression_slot', NULL, NULL, 'include-change-number', '1');
select count(distinct change->>'change_number') = 1
from results,
     json_array_elements(data->'change') change
;
 ?column? 
----------
 t
(1 row)

DELETE FROM results;
-- Two changes in two transactions should have one change_number
INSERT INTO tbl VALUES (2);
INSERT INTO tbl VALUES (3);
INSERT INTO results SELECT data::json FROM pg_logical_slot_get_changes('regression_slot', NULL, NULL, 'include-change-number', '1');
select count(distinct change->>'change_number') = 1
from results,
     json_array_elements(data->'change') change
;
 ?column? 
----------
 t
(1 row)

DELETE FROM results;
-- Two changes in one transaction should have two change_number
INSERT INTO tbl VALUES (4), (5);
INSERT INTO results SELECT data::json FROM pg_logical_slot_get_changes('regression_slot', NULL, NULL, 'include-change-number', '1');
select count(distinct change->>'change_number') = 2
from results,
     json_array_elements(data->'change') change
;
 ?column? 
----------
 t
(1 row)

DELETE FROM results;
-- Two changes in one transaction with write in chunks should have two change_number
INSERT INTO tbl VALUES (6), (7);
INSERT INTO results SELECT array_to_string(array_agg(data),'')::json FROM pg_logical_slot_get_changes('regression_slot', NULL, NULL, 'include-change-number', '1', 'write-in-chunks', '1');
select count(distinct change->>'change_number') = 2
from results,
     json_array_elements(data->'change') change
;
 ?column? 
----------
 t
(1 row)

DELETE FROM results;
-- Two changes in one transaction with write in chunks and object per chunk should have two change_number
INSERT INTO tbl VALUES (8), (9);
INSERT INTO results SELECT data::json FROM pg_logical_slot_get_changes('regression_slot', NULL, NULL, 'include-change-number', '1', 'write-in-chunks', '1', 'object-per-chunk', '1');
select count(distinct data->>'change_number') = 2
from results;
 ?column? 
----------
 t
(1 row)

DELETE FROM results;
-- Two changes in one COPY should have two changes and two change_number
COPY tbl FROM STDIN;
INSERT INTO results SELECT data::json FROM pg_logical_slot_get_changes('regression_slot', NULL, NULL, 'include-change-number', '1');
select count(distinct change->>'columnvalues') = 2, count(distinct change->>'change_number') = 2
from results,
     json_array_elements(data->'change') change
;
 ?column? | ?column? 
----------+----------
 t        | t
(1 row)

DELETE FROM results;
SELECT 'stop' FROM pg_drop_replication_slot('regression_slot');
 ?column? 
----------
 stop
(1 row)

